{
  "v": 1,
  "messageId": "8f3e2c1a-5b6d-4e7f-8a9b-000000000001",
  "organizationId": 1,
  "sourceId": 3,
  "externalId": "24e124136d151606",
  "deviceId": 21,
  "deviceStatus": "ACTIVE",
  "modelId": "1",
  "spaceId": 31,
  "measuredAt": "2026-10-03T02:40:09.123Z",
  "receivedAt": "2026-10-03T02:40:09.501Z",
  "late": false,
  "virtual": false,
  "metrics": [
    {
      "key": "temperature",
      "value": 22.3,
      "quality": 0,
      "unit": "℃"
    },
    {
      "key": "humidity",
      "value": 44.5,
      "quality": 0,
      "unit": "%"
    }
  ],
  "link": {
    "rssi": -71,
    "snr": 9.25,
    "frameCounter": 10211,
    "gateways": [
      {
        "eui": "24e124fffef79304",
        "rssi": -71,
        "snr": 9.25
      }
    ]
  },
  "meta": {
    "tags": {
      "location": "실습실",
      "point": "중앙 좌측"
    },
    "decoder": {
      "key": "chirpstack-v4",
      "version": "1"
    }
  },
  "rawMessageId": 8812345
}