{
  "v": 1,
  "messageId": "8f3e2c1a-5b6d-4e7f-8a9b-000000000003",
  "organizationId": 1,
  "sourceId": 3,
  "externalId": "24e124126d152590",
  "deviceId": 23,
  "deviceStatus": "ACTIVE",
  "modelId": "3",
  "spaceId": 31,
  "measuredAt": "2026-10-03T02:40:11.123Z",
  "receivedAt": "2026-10-03T02:40:11.501Z",
  "late": false,
  "virtual": false,
  "metrics": [
    {
      "key": "co2",
      "value": 1180,
      "quality": 0,
      "unit": "ppm"
    },
    {
      "key": "pressure",
      "value": 1004.2,
      "quality": 0,
      "unit": "hPa"
    },
    {
      "key": "temperature",
      "value": 22.1,
      "quality": 0,
      "unit": "℃"
    },
    {
      "key": "humidity",
      "value": 45.5,
      "quality": 0,
      "unit": "%"
    }
  ],
  "link": {
    "rssi": -80,
    "snr": 6.5,
    "frameCounter": 40211,
    "gateways": [
      {
        "eui": "24e124fffef79304",
        "rssi": -80,
        "snr": 6.5
      }
    ]
  },
  "meta": {
    "tags": {
      "location": "실습실",
      "point": "전방 좌측"
    },
    "decoder": {
      "key": "chirpstack-v4",
      "version": "1"
    }
  },
  "rawMessageId": 8812347
}